{"$schema":"https://json-schema.org/draft/2020-12/schema","$id":"https://jenfu.local/contracts/jenfu-platform-entitlement/v2/application-role-catalog.schema.json","type":"object","required":["applicationId","contractVersion","catalogVersion","publishedAt","roles","catalogSha256"],"properties":{"applicationId":{"type":"string","pattern":"^[a-z][a-z0-9-]{2,63}$"},"contractVersion":{"const":"jenfu.platform-entitlement.v2"},"catalogVersion":{"type":"string"},"publishedAt":{"type":"string","format":"date-time"},"capabilities":{"type":"array"},"roles":{"type":"array","items":{"type":"object","required":["stableRoleId","code","displayName","status","allowedScopeKinds","assignmentTier","permissions","roleDefinitionHash"],"properties":{"stableRoleId":{"type":"string"},"code":{"type":"string"},"displayName":{"type":"string"},"status":{"enum":["active","inactive","retired"]},"allowedScopeKinds":{"type":"array"},"assignmentTier":{"enum":["app_admin","cross_app_override"]},"permissions":{"type":"array"},"roleDefinitionHash":{"type":"string","pattern":"^[0-9a-f]{64}$"}}}},"catalogSha256":{"type":"string","pattern":"^[0-9a-f]{64}$"}},"additionalProperties":false}
