{"applicationId":"financial-management-system","capabilities":[{"code":"finance.dashboard.view","description":"查看管理儀表板","kind":"page","routes":["/dashboard"]},{"code":"finance.receivables.view","description":"查看應收帳款","kind":"page","routes":["/receivables"]},{"code":"finance.payables.view","description":"查看應付帳款工作台","kind":"page","routes":["/payables"]},{"code":"finance.funds.view","description":"查看資金池","kind":"page","routes":["/funds"]},{"code":"finance.allocations.view","description":"查看待分配款","kind":"page","routes":["/allocations"]},{"code":"finance.cashflow.view","description":"查看金流預測","kind":"page","routes":["/cashflow"]},{"code":"finance.approvals.view","description":"查看內控核准","kind":"page","routes":["/approvals"]},{"code":"finance.tax_risks.view","description":"查看稅務風險","kind":"page","routes":["/tax-risks"]},{"code":"finance.compliance.view","description":"查看合規轉型","kind":"page","routes":["/compliance"]},{"code":"finance.integrations.view","description":"查看 ERP 銜接","kind":"page","routes":["/integrations"]},{"code":"finance.executive_performance.view","description":"查看經營績效","kind":"page","routes":["/executive/performance"]},{"code":"finance.audit_logs.view","description":"查看 Audit Log","kind":"page","routes":["/audit-logs"]},{"code":"finance.exports.view","description":"查看匯出與備份","kind":"page","routes":["/exports"]},{"code":"finance.users.manage","description":"管理使用者","kind":"action","routes":["/admin/users"]},{"code":"finance.banking.view","description":"查看銀行對帳","kind":"page","routes":["/banking"]},{"code":"finance.payment_operations.view","description":"查看付款工作台","kind":"page","routes":["/payments"]},{"code":"finance.payment_request.create","contextRoutes":["/payables"],"description":"建立付款需求","kind":"action","routes":["/payments/request"]},{"code":"finance.payment_case.approve","description":"核准付款案件","kind":"action","routes":[]},{"code":"finance.capability_catalog.view","description":"查看自己的功能與權限目錄","kind":"page","routes":["/settings/access"]},{"code":"finance.role_assignment.manage","description":"管理財務角色指派","kind":"action","routes":[]}],"catalogSha256":"801c08887bdee6e082823400bc9ad37dd329474887d7774537161655d94332e3","catalogVersion":"financial-management-system.role-catalog.2026-09-03.v1","contractVersion":"jenfu.platform-entitlement.v2","publishedAt":"2026-09-03T00:00:00.000Z","roles":[{"allowedScopeKinds":["workspace"],"assignmentTier":"app_admin","code":"owner","displayName":"負責人","permissions":[{"allowed":true,"code":"finance.dashboard.view","kind":"page"},{"allowed":true,"code":"finance.receivables.view","kind":"page"},{"allowed":true,"code":"finance.payables.view","kind":"page"},{"allowed":true,"code":"finance.funds.view","kind":"page"},{"allowed":true,"code":"finance.allocations.view","kind":"page"},{"allowed":true,"code":"finance.cashflow.view","kind":"page"},{"allowed":true,"code":"finance.approvals.view","kind":"page"},{"allowed":true,"code":"finance.tax_risks.view","kind":"page"},{"allowed":true,"code":"finance.compliance.view","kind":"page"},{"allowed":true,"code":"finance.integrations.view","kind":"page"},{"allowed":true,"code":"finance.executive_performance.view","kind":"page"},{"allowed":true,"code":"finance.audit_logs.view","kind":"page"},{"allowed":true,"code":"finance.exports.view","kind":"page"},{"allowed":true,"code":"finance.users.manage","kind":"action"},{"allowed":true,"code":"finance.banking.view","kind":"page"},{"allowed":true,"code":"finance.payment_operations.view","kind":"page"},{"allowed":false,"code":"finance.payment_request.create","kind":"action"},{"allowed":true,"code":"finance.payment_case.approve","kind":"action"},{"allowed":true,"code":"finance.capability_catalog.view","kind":"page"},{"allowed":true,"code":"finance.role_assignment.manage","kind":"action"}],"roleDefinitionHash":"3d03a7bf2a44092bb1e1ca9aacea705d971697ba1bd03fe3b8dc1a83645ecccb","stableRoleId":"role-owner","status":"active","subjectKind":"employee"},{"allowedScopeKinds":["workspace"],"assignmentTier":"app_admin","code":"finance-manager","displayName":"財務主管","permissions":[{"allowed":true,"code":"finance.dashboard.view","kind":"page"},{"allowed":true,"code":"finance.receivables.view","kind":"page"},{"allowed":true,"code":"finance.payables.view","kind":"page"},{"allowed":true,"code":"finance.funds.view","kind":"page"},{"allowed":true,"code":"finance.allocations.view","kind":"page"},{"allowed":true,"code":"finance.cashflow.view","kind":"page"},{"allowed":true,"code":"finance.approvals.view","kind":"page"},{"allowed":true,"code":"finance.tax_risks.view","kind":"page"},{"allowed":true,"code":"finance.compliance.view","kind":"page"},{"allowed":true,"code":"finance.integrations.view","kind":"page"},{"allowed":true,"code":"finance.executive_performance.view","kind":"page"},{"allowed":true,"code":"finance.audit_logs.view","kind":"page"},{"allowed":true,"code":"finance.exports.view","kind":"page"},{"allowed":false,"code":"finance.users.manage","kind":"action"},{"allowed":true,"code":"finance.banking.view","kind":"page"},{"allowed":true,"code":"finance.payment_operations.view","kind":"page"},{"allowed":false,"code":"finance.payment_request.create","kind":"action"},{"allowed":true,"code":"finance.payment_case.approve","kind":"action"},{"allowed":true,"code":"finance.capability_catalog.view","kind":"page"},{"allowed":false,"code":"finance.role_assignment.manage","kind":"action"}],"roleDefinitionHash":"e945bd7da4f726fa3a07203120ade2ef45f2d907669b85fc92f36e326dd6611f","stableRoleId":"role-finance-manager","status":"active","subjectKind":"employee"},{"allowedScopeKinds":["workspace"],"assignmentTier":"app_admin","code":"finance-staff","displayName":"財務人員","permissions":[{"allowed":true,"code":"finance.dashboard.view","kind":"page"},{"allowed":true,"code":"finance.receivables.view","kind":"page"},{"allowed":true,"code":"finance.payables.view","kind":"page"},{"allowed":true,"code":"finance.funds.view","kind":"page"},{"allowed":true,"code":"finance.allocations.view","kind":"page"},{"allowed":true,"code":"finance.cashflow.view","kind":"page"},{"allowed":true,"code":"finance.approvals.view","kind":"page"},{"allowed":true,"code":"finance.tax_risks.view","kind":"page"},{"allowed":false,"code":"finance.compliance.view","kind":"page"},{"allowed":false,"code":"finance.integrations.view","kind":"page"},{"allowed":false,"code":"finance.executive_performance.view","kind":"page"},{"allowed":true,"code":"finance.audit_logs.view","kind":"page"},{"allowed":true,"code":"finance.exports.view","kind":"page"},{"allowed":false,"code":"finance.users.manage","kind":"action"},{"allowed":true,"code":"finance.banking.view","kind":"page"},{"allowed":true,"code":"finance.payment_operations.view","kind":"page"},{"allowed":true,"code":"finance.payment_request.create","kind":"action"},{"allowed":false,"code":"finance.payment_case.approve","kind":"action"},{"allowed":true,"code":"finance.capability_catalog.view","kind":"page"},{"allowed":false,"code":"finance.role_assignment.manage","kind":"action"}],"roleDefinitionHash":"615cd3596f97f0bed89f9f953487ea5e0d6185a01994c7d0530a9843d6b11c13","stableRoleId":"role-finance-staff","status":"active","subjectKind":"employee"},{"allowedScopeKinds":["workspace"],"assignmentTier":"app_admin","code":"sales","displayName":"業務","permissions":[{"allowed":true,"code":"finance.dashboard.view","kind":"page"},{"allowed":true,"code":"finance.receivables.view","kind":"page"},{"allowed":false,"code":"finance.payables.view","kind":"page"},{"allowed":false,"code":"finance.funds.view","kind":"page"},{"allowed":false,"code":"finance.allocations.view","kind":"page"},{"allowed":false,"code":"finance.cashflow.view","kind":"page"},{"allowed":false,"code":"finance.approvals.view","kind":"page"},{"allowed":false,"code":"finance.tax_risks.view","kind":"page"},{"allowed":false,"code":"finance.compliance.view","kind":"page"},{"allowed":false,"code":"finance.integrations.view","kind":"page"},{"allowed":false,"code":"finance.executive_performance.view","kind":"page"},{"allowed":false,"code":"finance.audit_logs.view","kind":"page"},{"allowed":false,"code":"finance.exports.view","kind":"page"},{"allowed":false,"code":"finance.users.manage","kind":"action"},{"allowed":false,"code":"finance.banking.view","kind":"page"},{"allowed":false,"code":"finance.payment_operations.view","kind":"page"},{"allowed":false,"code":"finance.payment_request.create","kind":"action"},{"allowed":false,"code":"finance.payment_case.approve","kind":"action"},{"allowed":true,"code":"finance.capability_catalog.view","kind":"page"},{"allowed":false,"code":"finance.role_assignment.manage","kind":"action"}],"roleDefinitionHash":"2da58d5bce8ec2c7e4ea07fe73904976cf640a03ac7a7ea2f582ef20ed2a6c6a","stableRoleId":"role-sales","status":"active","subjectKind":"employee"},{"allowedScopeKinds":["workspace"],"assignmentTier":"app_admin","code":"procurement","displayName":"採購","permissions":[{"allowed":true,"code":"finance.dashboard.view","kind":"page"},{"allowed":false,"code":"finance.receivables.view","kind":"page"},{"allowed":false,"code":"finance.payables.view","kind":"page"},{"allowed":false,"code":"finance.funds.view","kind":"page"},{"allowed":false,"code":"finance.allocations.view","kind":"page"},{"allowed":false,"code":"finance.cashflow.view","kind":"page"},{"allowed":true,"code":"finance.approvals.view","kind":"page"},{"allowed":false,"code":"finance.tax_risks.view","kind":"page"},{"allowed":false,"code":"finance.compliance.view","kind":"page"},{"allowed":false,"code":"finance.integrations.view","kind":"page"},{"allowed":false,"code":"finance.executive_performance.view","kind":"page"},{"allowed":false,"code":"finance.audit_logs.view","kind":"page"},{"allowed":false,"code":"finance.exports.view","kind":"page"},{"allowed":false,"code":"finance.users.manage","kind":"action"},{"allowed":false,"code":"finance.banking.view","kind":"page"},{"allowed":false,"code":"finance.payment_operations.view","kind":"page"},{"allowed":false,"code":"finance.payment_request.create","kind":"action"},{"a